{
  "schema_version": "1.0",
  "id": "spathi_selected_v1",
  "search_space": "experiments/v1/spathi/search-space.json",
  "status": "unselected",
  "phase": "planned",
  "selected_candidate": null,
  "selection_evidence": null,
  "test_accessed_before_freeze": false,
  "notes": [
    "No SPATHI configuration has been selected yet.",
    "This file may be frozen only after evaluating the predeclared finalists on validation datasets.",
    "Test datasets must remain inaccessible until the selected configuration is frozen."
  ]
}
